english_audio,english_text,tamil_text,tamil_audio
sample_1_english_dubbed.wav,MY NAME IS KINGDOM,என் பெயர் அரசன்,sample_1_tamil_final.mp3
sample_2_english_dubbed.wav,THE WEATHER IS VERY GOOD TO DAY,வானிலை மையம் நன்றாக இருக்கிறது,sample_2_tamil_final.mp3
sample_3_english_dubbed.wav,I LIKE TO SPEAK HIM DO,பேசுவதை நான் விரும்புகிறேன்,sample_3_tamil_final.mp3
sample_4_english_dubbed.wav,THIS IS A TESTE PHRASE,இது ஒரு test phrase.,sample_4_tamil_final.mp3
sample_5_english_dubbed.wav,INDIA IS A BEAUTIFUL COUNTRY,ஆஸ்திரேலியா அழகான நாடு,sample_5_tamil_final.mp3
